{
  "name": "Segmented Bucket-Hat Wader (Segmentus caputbalneus)",
  "body_plan": {
    "core_shape": "cylinder",
    "symmetry": "bilateral",
    "size_est_m": 0.6
  },
  "parts": [
    {
      "type": "body segment",
      "count": 5,
      "shape": "stacked orange circular blobs forming a totem-pole column",
      "placement": "vertical torso, rising from the blue water"
    },
    {
      "type": "hat/head-covering",
      "count": 1,
      "shape": "wide flat black brimmed cap",
      "placement": "top of the topmost orange segment"
    },
    {
      "type": "eye",
      "count": 1,
      "shape": "small round red dot",
      "placement": "on the uppermost segment, beneath the hat brim"
    },
    {
      "type": "arm",
      "count": 0,
      "shape": "none drawn",
      "placement": "n/a - implied to hide arms within segments"
    },
    {
      "type": "waterline",
      "count": 1,
      "shape": "jagged blue painted wave band",
      "placement": "across the bottom of the scene, submerging the lower body"
    }
  ],
  "palette": [
    "#e07b1a",
    "#c0392b",
    "#1a1a2e",
    "#1e3fd6",
    "#7a2e8f",
    "#2e7d32"
  ],
  "distinctive_features": [
    "body built entirely from stacked round orange segments like a bead totem",
    "wears a flat black bucket-style hat far too wide for its head",
    "single small red eye peeking from under the brim",
    "no visible arms or legs, stands half-submerged in wavy blue water",
    "appears alongside a companion red-bodied creature in a green hat, suggesting these are a matched pair species"
  ],
  "locomotion": "float",
  "vibe": "a stoic little water-totem taking a dip in its oversized hat"
}